name,city,neighborhood,summaryThe Cacao Bar by MarieBelle,New York,SoHo,The Old World holds sway at MarieBelle where antique glass cases are stocked with tins of cocoa powder. Tucked at the back the Cacao Bar has a &amp;quot;Bar at the Folies-BergÍ—‘Îre&amp;quot; feel: rusted mirrors a teardrop chandelier tiny round tables barely balancing plates of crepes and demitasse cups. While the setting says Paris the hot chocolate is pure Mesoamerican empire. Ranging from 60 to 75 percent cacao it is best made without milk so it is nearly as thick as pudding.The Chocolate Room,Brooklyn,Park Slope,The Chocolate Room in Park Slope Í¢‘„‘î there is a second location in Cobble Hill Í¢‘„‘î is a homespun place with exposed brick and tables clustered along a banquette. So it's a surprise to receive an amuse-bouche. Nothing fussy: just a cube of almond cake in a teaspoon on a micro-saucer awash in chocolate sauce. But it's the first of many thoughtful touches. The banana in the banana split for example is brulÍ—‘©ed. The Mexican hot chocolate is thrillingly dark with a crescendo of spice: on a wintry day solace in a cup. Vosges Haut-Chocolat,New York,SoHo,At this self-consciously glam spot everything is glossy white with a few bursts of purple. Swoopy plastic chairs line a marble-top communal table. &amp;quot;Exotic drinking chocolates&amp;quot; arrive in delicate flutes. Savories on offer include an elf-hat-shaped truffle embedded with taleggio cheese and a chocolate bar studded with bacon an homage to smoke and salt. Korzo,Brooklyn,Greenwood Heights,Eurotrip is the awkward if endearing name of a gastro-bar in Brooklyn's South Slope that serves the neighborhood well. The kitchen serves Mittel-European comfort food in what might be called recession-era portions. Choose from the 20-plus different beers including a handful on tap and a varied range of sausages.Naya Mezze and Grill,New York,Midtown East,New York has never had a Lebanese restaurant like Naya. But it is not only the shiny spaceship-to-SoHo decor that sets it apart. The menu pulls from both Lebanese mezze tradition - long-cooked vegetables pickles kebabs yogurt cheese - and more elaborate home-style dishes. Simple dishes like shrimp in a concentrated spicy tomato sauce with garlic and moudardara the classic Middle Eastern lentil-and-rice dish with threads of buttery caramelized onion are exceptionally balanced.Boqueria SoHo,New York,SoHo,This Boqueria the larger offspring of one in Chelsea is every bit as good as its sire. The handsome room is walled with white oak panels and tiles; there is an open kitchen and as at the original extra-high tables with high stools. The generously portioned patatas bravas is sparked by pimentÍ—‘_n and a roasted garlic aioli; a broad metal pan of baked cauliflower basically masquerades as quiche promiscuously cheesy and hammy. Boqueria plies adventurous waters presenting a whole fried baby sole and accessorizing fillets of line-caught fluke with not only king oyster mushrooms but also crosnes.Congee Bowery,New York,Lower East Side,The menu is so exhaustive it's exhausting. I followed a friend's advice and ordered House Special Chicken a whole roast chicken for two splayed open varnished with soy sauce crisp and succulent. It sounds familiar but it tastes unusually lively. Even snow pea shoots with garlic so often stringy arrive in a generous leafy mound.Corton,New York,TriBeCa,At Corton Paul Liebrandt finds the sweet spot between disciplined cooking and intricate imaginative leaps. Intricacy and imagination are still there: in a simultaneously ethereal and earthy 'risotto' that floats a white cloud of salt cod foam over a dark terrain of black trumpet mushrooms and riso pasta; in an 'olive sponge' canapÍ—‘© both lighter in weight and more intense in olive flavor than the laws of physics and gastronomy would seem to permit; in a seaweed butter served with the bread that called to mind caviar in a whole new guise. But these exertions aren't obvious or showy. They're a generous attempt to orchestrate a varied medley of tastes both more and less familiar.Pio Pio Salon,New York,Upper West Side,The trademark chicken has an addictively tangy note and it arrives with a spicy sauce made from cilantro lime and huacatay an Andean mint; it would be a bargain at twice the price. Add sides of rice and maduros sweet plantains and it's an avalanche of food. But you should still start with ceviche Lima style tender marinated corvina a kind of bass. And order a round of frothy pisco sours the most authentic Peruvian version I've found in New York. Village Yokocho,New York,East Village,The bilingual menu features six pages of yakitori kushiage (breaded and fried bites) broiled seafood and other small plates most meant for sharing. Raw squid tossed in spicy chili paste could get things going followed by a five-skewer yakitori combo and a languorous bowl of nabeyaki udon a wintry soup filled with chicken fish cakes and an egg that poaches in the broth. I wish there was a better shorthand for this kind of grazing than &amp;quot;tapas&amp;quot; but that's the word Village Yokocho uses.Momofuku Ssam Bar,New York,East Village,David Chang keeps demanding more from himself and his restaurants keeps giving us reasons not to stray. At freewheeling Ssam you can drop in for just 30 minutes have a snack of one or two small dishes pay just $20 for them. And yet the quality of the food Í¢‘„‘î its fastidious sourcing vibrant seasoning and ingenious grace notes Í¢‘„‘î isn't dumbed down in the least for an informal context. Mr. Chang trusts diners not to be disoriented by an assortment of dishes without any instantly clear theme or overriding ethnic allegiance Í¢‘„‘î by platters of artisanal American hams next to a tangle of Sichuan-style beef tendon alongside a hanger steak with a romesco sauce. He pulls off this eclecticism which could easily lapse into incoherence by keeping the menu sufficiently succinct and making sure everything on it counts.Pranna,New York,Midtown South,What is Pranna exactly? A vast nightclub and party space where dinner just happens to be an option? Or a serious Southeast Asian restaurant trapped in a gilded maze that can accommodate more than 400 guests? According to its Web site much of the menu was the outgrowth of eating that the chef Chai Trivedi did while traveling Í¢‘„‘î often on motorcycle Í¢‘„‘î through Thailand Vietnam India and other countries in that part of the world. But neither fuel nor a helmet nor a passport would seem to be prerequisites for the preparation of unimaginative entrees like stir-fried chicken and a rib-eye for two. More impressive though gimmicky is the restaurant's trademark assortment of satays skewered meats and fishes presented with a variety of dipping sauces including sour mandarin galangal and sweet lemongrass caramel. El Tesoro,Brooklyn,Sunset Park,The seafood fried rice called chaulafan is an Ecuadorean take on a Chinese standard so while the plate of shrimp egg peas tomato pork and beef is heavily tinged with soy sauce it's also studded with Ecuadorean black clam and sided with fried plantain. There's an orange hot sauce that glows only a little less than the neon bar signs. Morocho hot milk spiked with cinnamon has a white-corn payload at the bottom of the glass.Kanoyama,New York,East Village,Opened under a different name in the East Village in early 2004 Kanoyama has justly become a go-to place for sushi savants who are willing to trade away some atmosphere for top-flight fish at less-than-stratospheric prices. It's cramped. Service is slow. But the breadth of the selection of sushi and sashimi is thrilling and adventurous eaters will find items not presented in many other sushi restaurants. An omakase at the counter can be expensive but combination sushi and sashimi platters at the tables are a real bargain.Porchetta,New York,East Village,They beckon from the counter in their Henny Penny warmer with their come-hither glisten and porcine perfume. Pork loin wrapped in pork belly with fennel pollen garlic sage rosemary and fistfuls of salt and pepper roasted for five hours in a combi oven that has locked in their moisture.Wanting nothing but slicing onto Sullivan Street Bakery rolls these bundles have been known to make sandwich-lovers swoon.The chef Sara Jenkins is already saying she'll become bored with this strict pork diet and in the weeks she's been open she's experimented with expanding her eight-item menu running specials like parsnip soup.But patrons of her tiny East Village shop won't be fatigued by its namesake. The porchetta is too multifaceted all by itself. In central Italy where the dish originated they roast the entire pig.Here it only tastes as if you're eating the whole Hampshire beast. Tender loin mingles with dark-streaked belly and bits of skin which are as tacky as taffy on one side and so crunchy on the other that they pose a chewing hazard. It's a texture adventure.The sweet yin of the pollen and the yang of the salt simply boost its natural flavor.This is a small sandwich for the price but the pork is so extravagant it's just big enough. If you must make a pig of yourself get a side of potatoes; they're crisped in a roasting pan with leftover bits of the good stuff. Sushi Azabu,New York,TriBeCa,Sushi Azabu stands out in a crowded sushi marketplace on account of its sublime setting: an unmarked subterranean lair within and beneath a multi-ethnic restaurant in TriBeCa called the Greenwich Grill. While the quality of both the raw fish and the cooked dishes is erratic the sushi and sashimi here is hardly run-of-the-mill and a fine selection of it can be sampled in prix fixe meals that are reasonably priced for this kind of restaurant and for this kind of coddling service.Candle 79,New York,Upper East Side,One of the most beloved and ambitious vegan restaurants in New York Candle 79 doesn't quite make you forget that meat fish dairy and eggs aren't coming to the party. But it proves that you can have a festive enough time without them. It stretches over two comfortable floors of a spacious townhouse. Its hummus seasoned with smoked paprika is terrific and in some dishes it uses seitan a wheat gluten as a fairly deft mimic of meat: the seitan piccata bright with lemon and salty with capers is a minor revelation. Chocolate desserts could pass muster in a restaurant operating with fewer restraints and there's a list of interesting wines and beers affordably priced as is the food. No. 7,Brooklyn,Fort Greene,No. 7 is a comfortable restaurant with comfortable prices but it is not doing comfort food. It is doing big-city night-on-the-town chef food sophisticated assemblages like slices of rare tuna fanned out with crisp almost sweet Asian pear. This appetizer looks utterly cool and composed its rosy pink fish set off by the creamy white pear. But a shower of jalapeÍ—‘±o oil knocks it off balance and starts a battle for dominance Í¢‘„‘î hot? cold? Í¢‘„‘î that happily is never quite resolved. No new ground is broken here but the dish has a low-key tension thatÍ¢‘„‘Žs engaging and characteristic of the approach taken by the chef Tyler Kord. He does not land everything he launches. But the expertly cooked hanger steak with spicy kimchi pirogis overachieves and the banana pudding that should end your meal also ends any quibbles about No. 7. Socarrat Paella Bar,New York,Chelsea,In many ways Socarrat is a modest endeavor with severe limitations. It has just 24 seats all of them stools and all but four of those at a two-sided communal table without much elbow room. Its wine list is short it doesn't take reservations and people angling for stools have nowhere comfortable to wait. But where paella is concerned Socarrat's vision is expansive. It serves eight kinds: a classic paella with rabbit and snails; a paella with seafood but not meat; a paella with meat but not seafood; a vegetarian paella; a paella using a thin noodles in lieu of rice. These paella's aren't perfect but they're better than most paella around town and then nail that sticky crunchy bottom layer of rice the socarrat that gives the restaurant its name. A half dozen desserts and 20 tapas are also on hand but paella's the star. Apiary,New York,East Village,As befits a restaurant owned by a furniture company Apiary has snazzy chairs. Fetching tables too. Nut the food doesn't exert as seductive a claim to the diner's attention as the furniture. The company is Ligne Roset those Gallic mavens of sleek minimalism branching out here from ottomans to heirloom tomatoes. It is a co-owner of the restaurant with Jenny Moon who worked at Daniel and Tabla. Scott Bryan who was the chef at Veritas then moved to Virginia has returned to New York to be the executive chef replacing Neil Manacle.Delicatessen,New York,Nolita,Delicatessen may not be particularly good but it's smart and it understands its audience. To wit: the cheeseburger spring roll. It's one of this sleek cheeky-named downtown restaurant's most popular appetizers and most fitting inventions a tidy wedding of comfort food and trendy Asian canape. And it's emblematic of a place that gives hungry budget-conscious booze-filled young New Yorkers a menu and a setting that are totally approachable but have a glimmer of sophistication. Some dishes Í¢‘„‘î Reuben fritters a blintz with Nutella and banana Í¢‘„‘î tweak deli classics. Others like the juicy crunchy fried chicken just provide gut-busting nourishments. Salads and such give the waistline obsessives a way out. Yerba Buena,New York,East Village,The menu floats across national borders and it feels as if the kitchen is still finding its footing. Some dishes live up to their billing like the luscious suckling pig with yucca puree but others miss like the under-seasoned grouper. Some do both like the beef short rib. But the cocktail list is a knockout and everything tastes good while sipping a Poquito Picante a citrusy gin drink with cilantro cucumber and jalapeÍ—‘±o. Kai Feng Fu Dumpling House,Brooklyn,Borough Park,In New York shao bing (sesame pancakes) often appear at Beijing-style fried dumpling shops known for their remarkable price-to-quality ratio and their lack of amenities like chairs. But they also make niu rou shao bing an exquisite sandwich on bread that rivals anything from Sullivan Street Bakery or Tom Cat Bakery. Right out of the wok the shao bing are sprinkled with sesame seeds hacked into wedges dabbed with hoisin sauce and stuffed with braised beef. The crunchy sandwich shows off the breadÍ¢‘„‘Žs flaky inside subtle scallion flavor and golden crust. Kai Feng Fu Dumpling House in Sunset Park Brooklyn is one of the best of New YorkÍ¢‘„‘Žs new crowd of specialists in this mian shi meaning flour food Í¢‘„‘î dumplings noodles and bread Í¢‘„‘î a staple of Northern China. Little Morocco,Astoria,Astoria,Little Morocco is a breezy cafe in Astoria Queens on Steinway Street south of the Grand Central Parkway a thoroughfare lined with hookah cafes halal butchers Middle Eastern bakeries and North African restaurants; a mosque across the street provides a steady stream of customers. Paprika-reddened merguez sausages are made daily at the cafe cooked to order and stuffed into crusty grilled &amp;quot;petit pain&amp;quot; Í¢‘„‘î &amp;quot;little bread&amp;quot; in Casablanca a k a Italian rolls in Queens Í¢‘„‘î with cubes of cucumber and tomato chopped green olives and a hot-pink spicy garlicky harissa also made in-house. Wine vinegar and extra oil emulsify the harissa into a tangy sandwich spread that takes a bow toward mayonnaise. Taim,New York,West Village,To make a great falafel sandwich with its many components -- hot and cool crunchy and soft spicy and smooth -- is exacting. Taim's version is transformed by the fresh herbs that go into the dough: typically a golden mass of chickpeas but bright green here from quantities of cilantro parsley and mint. That breath of fresh herbs along with the crunch of the hot crust and the earthy cream of the tahini pulls the Taim falafel to the front of the pack.Rusty Knot,New York,West Village,The Rusty Knot is downtown decorated in a shabby-chic vein and connected by ownership to the Spotted Pig and Freemans. But itÍ¢‘„‘Žs not putting a falsely modest skin over a soul of discernment. It takes its lack of pretension seriously which is no doubt oxymoronic and the very essence of its charm. On the jukebox you find songs like HeartÍ¢‘„‘Žs &amp;quot;Little Queen.&amp;quot; Only four booths none of which can be reserved accommodate 16 people at most. Otherwise itÍ¢‘„‘Žs scattered stools and armchairs and the fish tank. But the food is the giveaway: there are smidgens of ambition and vanity at work. A hot dog is cradled by a delectable spiral of soft pretzel instead of a roll; peel-and-eat shrimp tucked into a plastic basket and doused with Old Bay are tender. Most people arenÍ¢‘„‘Žt eating though. TheyÍ¢‘„‘Žre drinking as they watch the sun set over the Hudson just across the West Side Highway and so close you can imagine someone pulling up to the Rusty Knot in a boat. Mas,New York,West Village,Even as it ages the West Village restaurant Mas which evokes a French farmhouse (but with a decidedly Manhattan sheen) still feels every bit as attentive eager and earnest as it did when it opened in March 2004. In fact it has used age to its advantage: its talented chef Galen Zamarra makes better decisions and his kitchen operates with more diligence than in the past. Here you'll find intricately wrought dishes that incorporate French influences and reflect the season. You'll find a menu that changes as quickly as any other around town. You'll more fine-restaurant flourishes-- a serious wine list a serious cheese list -- than at other niches of this relatively modest scale. Mas isn't quite as reliable as a restaurant of its considerable expense should be but it's usually a sweet happy getaway.Nizza,New York,Clinton,Nizza which uses the Italian name for the French city of Nice offers a wide variety of salads pizzas that arenÍ¢‘„‘Žt destination fare but are easy to scarf and a selection of main courses that are filling enough to get you through a four-act play. But the best approach is snacking: a plate of salumi; an order or two of excellent socca the savory pancake made from chickpea flour thatÍ¢‘„‘Žs a regional staple; and the creamy-crisp chickpea fries called panisse. Sookk,New York,Upper West Side,Interesting if unsteady food makes Sookk an exception to the increasingly charmless Thai restaurants of Manhattan. It sets out to introduce New Yorkers to a very specific strand of Bangkok street food: that of Yaowarat Road the central thoroughfare of BangkokÍ¢‘„‘Žs Chinatown which is lined with the stalls of Chinese herbalists. The word &amp;quot;herbs&amp;quot; signals the best food on the long menu: Yaowarat herbs stewed beef soup is a deeply spiced rounded beefy broth poured over crunchy mouthfuls of bean sprouts and cilantro; herbal cinnamon duck is an aromatic clay-pot braise with mushrooms red dates and ginkgo nuts. Tables are tiny every plate is oddly shaped and about three times too large. Constant shuffling results. La SirÍ—‘Îne,New York,SoHo,It's important not to oversell the eccentric little bistro La SirÍ—‘Îne which operates on a shoestring doesn't have a liquor license and doesn't ace many of the dishes on its relatively short French menu. The escargot covered in buttery bread crumbs is better than the beet salad doused with too much truffle oil. The gooey dark chocolate cake outshines the wispy chocolate mousse. But this minimally decorated cramped 25-seater by the Holland Tunnel provides a warm change of pace from the vacuous polish and higher prices of better-known establishments. Its chef a transplanted Frenchman named Didier Pawliki is more dedicated than most of his better-known peers. Plus he does memorable cassoulet and profiteroles. Order those watch him ping around the restaurant and just try not to smile.Bar Boulud,New York,Upper West Side,Continuing a trajectory of ever-more-casual restaurants Daniel Boulud has made Bar Boulud which opened at the start of 2008 a place where many of the seats are at a long counter walk-in business is encouraged and the star attractions aren't the entrees. They're the fantastic charcuterie selections --- terrines pates sausages --- and a terrific wine list that emphasizes Burgundy and the Rhone and has many fine options below $75 a bottle. A more conventional three-course meal can be had and it can be quite good but that's not the best use of Bar Boulud strategically positioned just opposite Lincoln Center the better to pick off members of the artsy herd stampeding into and out of performances. Word to the wise: go at lunchtime and have the Croque Monsieur. It's a sandwich with delusions of quiche-ness. Grand Tier Restaurant,New York,Upper West Side,Umberto Montano exported the modern Florentine menu of his restaurant Alle Murate which is in a 14th-century frescoed palace in Florence Italy. Jeff Raider is his executive chef.Dovetail,New York,Upper West Side,On a patch of the Upper West Side with an unreliable appetite for adventurous and somewhat fussy dining the chef John Fraser has opened a restaurant that delivers precisely that experience and the packed dining room on a blustery weeknight was a testament to how well he pulls it off. He and his pastry chef Vera Tong cook with intellect and wit but they seldom get too cerebral too cute. His pork-belly-and-egg dish is breakfast as an appetizer only at breakfast the belly is smoked and called bacon. Her brioche bread pudding with bacon brittle is breakfast as dessert only at breakfast the bread is called French toast. And so it goes at this warm intriguing restaurant with a brown palette exposed brick and bare wood tables that balance out the ambition of the food. Gazala Place,New York,Clinton,At Gazala Place the best way to get a taste of Druse cuisine is to order a platter of appetizers for the table and share it. The menu is similar to many Middle Eastern places but there are slight differences; for example instead of serving pita bread Gazala Halabi grills saag. It's thinner than a crepe as wide as a small pizza and pliable like lavash.Second Avenue Deli,New York,Kips Bay,The Second Avenue Deli's pastrami is borscht red and tender. The chicken soup brims with fresh dill. And the matzoh brei is the epitome of breakfast comfort. But in the end the Second Avenue Deli reborn on East 33rd Street near Third Avenue isn't about a lineup of Jewish deli classics that please and a lineup of other classics (the latke the chopped liver) that disappoint. It's about the sport of friendly bickering over proper seasoning correct condiments corned beef versus tongue. It's about nostalgia. To eat here is to pass through a communal storehouse of memories on a bridge of babkas from the past to the future. Soba Totto,New York,Midtown East,Soba Totto boasts a number of qualities that have come to mark Ryuichi Munekata's restaurants: a kitchen overseen by Mika Ohie that executes its duties with precision and consistency; a menu where unvarnished classics and more offbeat dishes mingle; service that is gracious and accommodating and just languid enough to give you time to polish off your drink and order another. Ilili,New York,NoMad,In terms of setting Ilili is probably the grandest excursion into Middle Eastern cooking that New York has seen its 300-plus seats distributed through rooms with high ceilings and an amber-glowing dÍ—‘©cor. And so foie gras wagyu beef and raw bluefin tuna are on the menu in accordance with the current dictates for taking a medium-profile cuisine into the big time and charging a high price for it. The specific geographic point of reference is Lebanon though the chef Philippe Massoud brings other countries of the Mediterranean into play as well. He does terrific work with grilled meats and with the classics: falafel tabouleh and the like. His more playful and creative dishes Í¢‘„‘î duck schwarma anyone? Í¢‘„‘î arenÍ¢‘„‘Žt as reliable. Amber,New York,Upper West Side,Asian fusion found a home on the Upper West Side when Amber opened as a casual space offering Japanese Chinese and Thai specialties. A cocktail lounge and sushi bar takes up the front of the restaurant and the back dining room's exposed brick wall is lined with Asian art. They typical Asian dishes like curry and special sushi rolls fill a mostly affordable menu.Hakata Tonton,New York,West Village,There's just one catch at Hakata Tonton a restaurant where the portions arenÍ¢‘„‘Žt Lilliputian and the staff is friendly: nearly all the dishes save the sweets incorporate Í¢‘„‘î and in most cases glorify Í¢‘„‘î pigsÍ¢‘„‘Ž feet. Those that don't like a pig's ear salad or an order of calf liver sashimi aren't going to do much for those not inclined to eat pigs' feet either. But while some might expect this to be a parlor of extreme eating there isn't a macho vibe at the restaurant; it's quiet even reserved. The place feels honest and genuinely warm even if it is genuinely weird. Bacaro,New York,Lower East Side,A basement on the Lowerest East Side Bacaro Í¢‘„‘î from Frank DeCarlo one of the people behind the NoLIta institution Peasant Í¢‘„‘î serves so-so Italianate dishes and expensive wine. But regardless of the food (all of it under $20) the lure of its dark wood chandeliers marble-top bar upstairs and cozy grotto below is likely to continue to draw in the young and attractive set. 