name,city,neighborhood,summaryCafÍ—‘© Rue Dix,Brooklyn,Crown Heights,CafÍ—‘© Rue Dix is a restaurant firmly of the neighborhood but cosmopolitan in outlook mixing plates of French moules frites and Senegalese thiebou djeun spinning Edith Piaf between griot rap and mbalax. ItÍ¢‘„‘Žs run by a local married couple: Lamine Diagne who grew up in Dakar (and borrowed the restaurantÍ¢‘„‘Žs recipe for Scotch bonnet sauce from his mother) and Nilea Alexander who helped design the appealing space with geometric textile patterns and lamps made out of gourd drums. Feel free to mix and match cuisines and linger over profiteroles and attaya gunpowder green tea poured from a height.Bar Primi,New York,East Village,One of several reasons to like Bar Primi Andrew CarmelliniÍ¢‘„‘Žs new two-story restaurant on the corner of Second Street and the Bowery is that there is almost nothing on the menu but appetizers and pasta. You can eat all the things you go to Italian places for without ordering a $35 grilled salmon simply to prove that you know fusilli is not considered a main course in Milan. Within Mr. CarmelliniÍ¢‘„‘Žs fleet Bar Primi is more a neighborhood hangout in the spirit of the Dutch than a big booming circus like Locanda Verde or Lafayette. Like all of those places and very much unlike the stereotypical linguine slinger Bar Primi has a wine list you could happily get lost in. There are 12 pastas on the menu and one of them is almost certain to be exactly what you feel like eating. Somewhat off the linguine theme but very much on the hangout theme there is at all hours a great hot roast beef sandwich shaved thin and kicked into action with red-hot pepper relish. Moldova,Brooklyn,Midwood,At Moldova the cityÍ¢‘„‘Žs one restaurant devoted to the cooking of the small former Soviet republic you might feel as if youÍ¢‘„‘Žd crashed a wedding and been immediately made welcome. The details are genuine as is the food: soups of primal sourness; mamaliga a cornmeal porridge that accompanies almost every entree; and baba neagra a dark fang of a cake traditionally made with chisleag or soured milk and flanked by sour cherry sauce in slashes. BÍ—‘¢tard,New York,TriBeCa,There are high spirits in BÍ—‘¢tardÍ¢‘„‘Žs dining room which hums and at times roars with the sound of people having a fine night on the town. Markus GlockerÍ¢‘„‘Žs cooking plays well with others and his flexible Í—‘_ la carte menu encourages you to get to know a bottle or two. For some drinkers it will be impossible not to order Burgundy at a restaurant called BÍ—‘¢tard although noncomformists will find blue-chip Napa Valley wines and a deep  pocket of whites from Alsace Germany and Austria where Mr. Glocker was born. BÍ—‘¢tard is hardly a cruise down the beautiful blue Danube but the kitchen can give you an excellent Viennese dinner in the form of the poussin schnitzel a special in perpetuity and the Sacher torte a special on occasion. Both are classical the chefÍ¢‘„‘Žs fingerprints visible only in details like the mouthwatering sea buckthorn jam and unaccountably exciting potato salad with the schnitzel. Elsewhere on the menu Mr. Glocker explores other flavors and regions but the complexity of his plates never blurs the focus of his flavors. Every drop of sauce and pinch of seasoning extracts some new pleasure out of the main ingredient. There is joy in his cooking. Delaware and Hudson ,Brooklyn,Williamsburg,Delaware and Hudson looks the part of the contemporary Brooklyn restaurant that preaches all things local and seasonal. The walls are pinned with glamour shots of farmersÍ¢‘„‘Ž market bins piled with strawberries and purple-tipped asparagus. The cooking stands out from the pack though in part because they draw on the traditions of long-gone Americans who would have been amazed to hear that farm-to-table would become a slogan one day. Old-time mid-Atlantic recipes (Í¢‘„‘ñfrom Baltimore to Buffalo\u201d says a sign by the door) flit on and off the weekly menus along with contemporary seasonal cooking and some Italian-style pasta. Indian Road Cafe,New York,Inwood,For anyone who doesnÍ¢‘„‘Žt happen to live in this Manhattan neighborhood which is so far north that it brushes against the backside of the Bronx wandering into Indian Road Cafe is like discovering a secret hideaway. The cafe has quietly evolved into an unpretentious clubhouse and on any given night itÍ¢‘„‘Žs abuzz with music and bonhomie. In the culinary tug-of-war between innovation and familiarity the chef Nicholas Wright-Bodine pulls tenaciously for Team Comfort.The Bronx Beer Hall,Bronx,Belmont,The Bronx Beer Hall is a noble effort to coax some youthful energy into one of New York CityÍ¢‘„‘Žs legendary Italian-American neighborhoods. And itÍ¢‘„‘Žs a lovely place to loaf nibbling on terrifically lip-searing chicken wings and sipping from a well-chilled selection of local brews. Much of the pub grub is disappointingly off though. Skip the gristly pork sliders and the mushy misguided truffle burger and steer toward the sandwiches from Mike's Deli the Greco family's counter a few yards away.Ivan Ramen,New York,Lower East Side,Ivan Orkin the Long Island-born chef who made his name cooking ramen in Tokyo comes home with a restaurant that shows his breadth as a chef. He skillfully and energetically colors outside the lines of Japanese food with cultural allusions that come fast quick and from several directions at once. Hot ramen isnÍ¢‘„‘Žt the only thing to eat and it isnÍ¢‘„‘Žt necessarily the most interesting; in the early days it was served below ideal temperature. But other dishes are fully realized especially the dry-style ramen called mazemen of which Mr. Orkin is the cityÍ¢‘„‘Žs reigning master. Lumpia Shack Snackbar,New York,West Village,At Lumpia Shack Snackbar Neil Syham the chef makes pretty but still potent versions of Filipino classics like sisig Í¢‘„‘î a hash of pig ears jowls and belly brined blanched shattered and fried. He turns crispy pata traditionally half a pigÍ¢‘„‘Žs leg deep-fried whole into fries. The storefront is minimalist. There are just a few stools along the counter which is too bad because this is food best eaten on the spot.Brooklyn Ball Factory,East Williamsburg Brooklyn ,Williamsburg,There are prettier outdoor dining spaces in the city but few with quite the juxtaposition of serenity and grit as the rooftop at Brooklyn Ball Factory a Japanese comfort food and coffee shop in East Williamsburg. The titular meatballs along with the likes of shabu-shabu-style pork and misoyaki salmon come in nicely tricked out bento boxes with excellent pickles and nothing surpasses $12.Russ &amp; Daughters Cafe,New York,Lower East Side,The new Russ &amp; Daughters Cafe is modeled to an almost obsessive degree on the old Russ &amp; Daughters shop a few blocks away on East Houston Street. In the center of the restaurant sides of salmon and whole golden-skinned whitefish with their slit bellies pointing up wait in a refrigerated case until they are sliced to order by a counter worker in a white jacket just as at the original. But the cafe adds to elaborates on and deviates from the store in ways that make it a three-dimensional restaurant not just a theme-park homage designed to cash in on the originalÍ¢‘„‘Žs popularity. Racines NY ,New York,TriBeCa,Racines NY is a branch of one of ParisÍ¢‘„‘Žs most influential wine bars. It has very little in common with the original but it has virtues of its own. For one thing itÍ¢‘„‘Žs not really a wine bar; itÍ¢‘„‘Žs a restaurant or Í¢‘„‘ñneo-bistro\u201d in the ownerÍ¢‘„‘Žs term. The cooking is brought to a pitch of refinement thatÍ¢‘„‘Žs at odds with the wine bar spirit and the menu is designed more for dining that snacking while you talk about how extremely well priced that bottle of Chinon is. The restaurantÍ¢‘„‘Žs charms do not include its dÍ—‘©cor. While New Yorkers have come to expect every French restaurant to evoke Paris; this one might have come out of a spread in the Restoration Hardware catalog.The Gander,New York,Flatiron,Jesse Schenker the GanderÍ¢‘„‘Žs chef had a breakout hit in 2010 with his debut restaurant Recette where the room is noisy and cramped and the cooking sharp at times coruscating. The Gander is more relaxed in ambition aiming to be a neighborhood joint. Too bad itÍ¢‘„‘Žs trapped in the body of a high-end restaurant with prim sconces over-bright lights and an aura of being slightly tranquilized. Grindhaus,Brooklyn ,Red Hook,Aaron Taber the chef at Grindhaus makes the kind of earnest fashionably austere handsomely arranged food that is signified on menus by sans-serif lists of ingredients with no capital letters verbs articles or hint of how one thing might relate to the next. In some restaurants they donÍ¢‘„‘Žt relate; at Grindhaus they do. Mr. TaberÍ¢‘„‘Žs style of cooking is often found in druidic wood-filled restaurants with painfully earnest names derived from natural materials like Resin. Grindhaus isnÍ¢‘„‘Žt as high-minded as those places. It has some rock Í¢‘„‘ƒnÍ¢‘„‘Ž roll in its trousers. A steel silhouette of a  broken wine glass has been painted in the front window and the jagged shards  attached to the stem look like the fingers of a hand raised in a heavy-metal salute. Khao Kang,Elmhurst Queens,Elmhurst,At Khao Kang there is no menu or wait service. Food is premade and presented cafeteria style. The steam-table joint is based on an honorable and beloved class of eatery in Thailand known as raan khao kaeng or rice-curry shop. The chef and owner Sopon Kosalanan who emigrated to the United States from eastern Thailand cooks alongside his mother and his aunt.Chayhana Salom,Sheepshead Bay Brooklyn,Sheepshead Bay,Chayhana SalomÍ¢‘„‘Žs charming dining room is clean and bright behind its slightly grubby storefront. Food is served on formal china with glimmers of gilt. Every meal should include patir so gorgeously fluffy it hardly merits the term flatbread; samsa packed loosely so the ground lamb filling falls apart instantly in the mouth; chewy hand-stretched lagman noodles; and plov UzbekistanÍ¢‘„‘Žs national dish here made in the style of Tashkent the ownersÍ¢‘„‘Ž hometown.Uma's, Rockaway Park Queens,The Rockaways,UmaÍ¢‘„‘Žs may be the only Uzbek restaurant in the United States with surfboard parking the Velvet Underground blaring and organic kale salad as an occasional special. It is owned by Conrad Karl and his wife Umida known as Uma who is also the chef and is from Samarkand Uzbekistan. Ms. KarlÍ¢‘„‘Žs dishes are friendly and accessible as is the restaurantÍ¢‘„‘Žs laid-back urban-beach decor with a photograph of Duke Kahanamoku on the wall and a childÍ¢‘„‘Žs surfboard leaning in a corner Í¢‘„‘î belonging to the KarlÍ¢‘„‘Žs daughter already a surf champion.Baoburg,Brooklyn ,Williamsburg,BaoburgÍ¢‘„‘Žs idiosyncratic menu owes as much to classical European technique as it does to the cross-cultural upbringing of the chef Suchanan Aksornnan (known as Bao Bao) who grew up in northern Thailand came to New York at age 15 and started cooking alongside her mother at a Thai restaurant in Williamsburg Brooklyn. Prunes cowled in bacon are adorned with eel sauce mayonnaise and bonito flakes in the style of Japanese takoyaki; lemon grass and kaffir lime infiltrate gambas al ajillo; crispy Chinese egg noodles share a bowl with chewy Italian linguine. This isnÍ¢‘„‘Žt globe-trotting for its own sake; the best dishes have both whimsy and logic.Tavern on the Green,New York,Upper West Side,Compared with its last days before its death of insolvency in 2009 made it the subject of countless dry-eyed eulogies Tavern on the Green is much much improved. The building constructed in 1871 as a dormitory for the grass-munching residents of the Sheep Meadow has been woven into the life of Central Park again. But two months after opening the kitchen was still struggling to serve the 350 seats indoors and another 350 outside. A Voce Madison ,New York,Midtown South,No longer as imperative as it was under A VoceÍ¢‘„‘Žs founding chef Andrew Carmellini the cooking at A Voce Madison has taken an understated turn that still offers a rewarding spin on modern Italian cuisine.Houdini Kitchen Laboratory,Queens,Bushwick,At this pizzeria in a former brewery on the border between Bushwick Brooklyn and Ridgewood Queens ceilings are 15 feet high windows 9. Flames rear up inside a wood-fired pizza oven on the far wall. Floors are concrete under long-stemmed hooded lamps and communal tables meant for 10. The pies have tooth bending without flopping staying chewy all the way to the knobby outer rim; they are uniformly excellent and occasionally achieve transcendence. There is no sign and the entrance through a fence at the back of the building is unmarked. But Houdini isnÍ¢‘„‘Žt an of-the-moment speakeasy; it is simply and wonderfully a restaurant with good food and earnest intent that just happens to be in one of the coolest spaces in the city.Flinders Lane,New York,East Village,ThereÍ¢‘„‘Žs a genial ambiculturalism at play at this modern Australian restaurant which shows clear affection for English tradition while reaching across the Indian Ocean and the South China Sea for more fervent flavors and celebrating Í¢‘„‘ñbush tucker\u201d indigenous foods like Tasmanian mountain pepper berry wattle seed and Anzac biscuits. The dÍ—‘©cor pays homage to the gritty history of Flinders Lane a former rag-trade district in Melbourne.Gato,New York,NoHo,The first new restaurant Bobby Flay and his business partner Laurence Kretchmer have opened in New York City in a decade Gato is nominally Mediterranean but the chef rides herd on pastas and pizzas and romesco sauces with a go-for-broke intensity thatÍ¢‘„‘Žs 100 percent American. Mr. Flay brushes flavor on his ingredients in thick impasto strokes making each plate a three-dimensional aggregation of char smoke capsicum sugar acid and fat. The cooking at Gato is many things often all at the same time but it is rarely shy.Spicy Lanka,Jamaica Queens,Jamaica Hills,The murals on Spicy LankaÍ¢‘„‘Žs walls and ceiling Í¢‘„‘î of blue sky banana fronds and distant birds with eyelash wings Í¢‘„‘î were painted by Pratheepan Selvachandran who runs the restaurant with his wife Marie De Silva;  both are natives of Sri Lanka. The menu is terse and cryptic; best just to ask for recommendations like pittu squat columns of roasted rice flour steamed with pandan leaves and adorned with icing-white curls of coconut or string hoppers flat pale nests of skinny rice-flour noodles used to scoop up thin yellow curry that drips through the noodlesÍ¢‘„‘Ž mesh and down the fingers.The Simone,New York,Upper East Side,A classic Manhattan restaurant that seems to have emerged fully formed out of a time capsule sealed in the last century the Simone has the kind of textured lived-in analog warmth that has become rare in ManhattanÍ¢‘„‘Žs increasingly corporatized professionalized restaurant scene. Tina Vaughn an owner who presides over the dining room takes down reservations in an actual book with an actual pen the same tool she uses to write the menu in cursive each time it changes. Though expensive and formal with waiters in vests and neckties primping white tablecloths the restaurant isnÍ¢‘„‘Žt starchy at all. ItÍ¢‘„‘Žs a living breathing mom-and-pop outfit where Ms. Vaughn will gush with bubbly pride about the new ProvenÍ—‘_al rosÍ—‘© sheÍ¢‘„‘Žs about to uncork while her husband Chip Smith channels his pride into the cooking. Mr. Smith works within French tradition in a manner that was almost the default New York style 15 or 20 years ago. He is not rewriting the rules of French cooking; itÍ¢‘„‘Žs simply the language he speaks and heÍ¢‘„‘Žs fluent enough that he can use it to talk about the ingredients in his part of the world. Box Kite,New York,East Village,At night this speck of a coffee shop serves an 8-to-10-course tasting menu at a counter with creaky swivel chairs cater-corner to a kitchen improvised out of a couple of induction burners and what one of the chefs describes as Í¢‘„‘ña glorified toaster oven.\u201d The $85 prix fixe while an investment isnÍ¢‘„‘Žt the enervating marathon that tastings at much higher price points can be. ItÍ¢‘„‘Žs more summer playlist than Í¢‘„‘ñRing\u201d cycle a tumble of ideas that intrigue and vanish delightful precisely because they are fleeting. The chefs take turns presenting dishes rattling off a litany of ingredients with such genial nonchalance that the repeated phrase Í¢‘„‘ñfreshly foraged\u201d doesnÍ¢‘„‘Žt come across as precious. Many a sauce is sluiced tableside sometimes with a touch too much exuberance but the spills feel like part of the show. Narcissa ,New York,East Village,The chef John Fraser is known for his refined thought-out vegetable tasting menus at Dovetail on the Upper West Side. His vegetable plates at Narcissa in the Standard East Village hotel are more unbuttoned and generous. TheyÍ¢‘„‘Žre complex but in a relaxed way that fits this casual many-things-to-many-people dining room where tables of chef chasers sit next to narrow-waisted colts who look as if they get their nutrients from air kisses. The vegetables have a swaggering originality that arenÍ¢‘„‘Žt always matched by the meat and seafood dishes some of which seemed designed for jet-lagged hotel guests who donÍ¢‘„‘Žt want any back-talk from their dinner. Eim Khao Mun Kai,Elmhurst Queens,Elmhurst,At Eim Khao Mun Kai the only dish on the menu is khao man gai a sort of punkified cover version of Hainanese chicken rice. The chicken is organic poached whole with ginger and comes with gizzards and liver. But it is mere garnish for the rice which is gilded with chicken fat skimmed off the top of the poaching liquid and then cooked in the broth and sluiced with a sauce adrenalized by birdÍ¢‘„‘Žs eye chilies and fermented yellow soybean paste. Between bites a bowl of the broth offers a cleansing reprieve.Khao Man Gai NY,Long Island City Queens,Long Island City,Emorn Henshaw who grew up in northeast Thailand spent two years perfecting her recipe for khao man gai (literally translated as chicken fat rice) before she and her husband Eric started serving it at artisanal food markets. The chicken is silky and appears without skin or offal. The rice is loose and perfumed with pandan leaves with only a hint of chicken fat and the sauce is more sweet than spicy. The soup is delicate verging on transparent. As a meal it is subtle and wholesome although you miss a little of the dishÍ¢‘„‘Žs traditional thrilling heat.River Cafe,Brooklyn,Fulton Ferry,No place in the city combines spectacle with hideaway intimacy and undiluted romance the way the River CafÍ—‘© does. And if more customers will take photographs of the Brooklyn BridgeÍ¢‘„‘Žs steel underbelly than of their plates the food is still much better than you might fear if youÍ¢‘„‘Žve been to other restaurants with souvenir views.El Quinto Pino,New York,Chelsea,A short Í¢‘„‘ñmenu turistico\u201d investigates a different region of the country every few months which gives regulars a reason to keep coming and gives the kitchen a launching pad for dishes that might hit the permanent roster. Other than that the tapas arenÍ¢‘„‘Žt tied down to any one Spanish region or even to Spain itself; the sandwiches roam as far afield as Mexico and New Orleans. Seafood is appealing and out of the ordinary with rarely-seen items like fried sea anemone in scrambled eggs. The thirty seats in the dining room feel romantic but not in an obvious way. ItÍ¢‘„‘Žs a room meant for talking.Dotory,Brooklyn,Williamsburg,Dotory is a tiny mostly serene bastion of quiet eccentricity under the J M and Z tracks in East Williamsburg Brooklyn. Few are the restaurants equipped with both a faux fireplace complete with electric log and in the bathroom a thumbtacked Balthus print and a book of paintings by Camille Bombois. Pink-tipped paper lanterns fringe the windows; utensils are slung in coffee cans. The owner Haegeen Kim a native of Seoul is something of an accidental chef having gone from art school to waiting tables to the kitchen. Her best dishes are the ones truest to her heritage like crackly-edged pa jun and kimchi fried rice dishes to soothe a drunk.Cagen,New York,East Village,Toshio Tomita the chef and owner worked for 16 years for Nobu Matsuhisa and he has his mentorÍ¢‘„‘Žs ability to bend Japanese tradition in his own directions. One minute Mr. Tomita will do the unadorned non-interventionist thing you expect from a Japanese chef. His ingredients especially the fish he brings in from Japan are often exceptional. But then there are little flavor bombs from unexpected sources like the chimichurri made with shiso yuzu and no small dose of jalapeÍ—‘±o for basting on slices of pliant tender sashimi. An omakase meal brings a rare treat the cold soba noodles made from buckwheat flour that Mr. Tomita grinds by hand between stones the size of a birdbath. Ristorante Morini,New York,Upper East Side,Most of the food here is as carefully prepared and well-considered food as any that Michael WhiteÍ¢‘„‘Žs Altamarea Group has given New York since Ai Fiori opened in 2010. The seafood tends to outshine the other options but you should get an excellent meal if you stick to the cured and raw crudi; the pastas which are as good as they are at any Michael White restaurant which is to say they are as good as at any place in the city; and dessert overseen by AltamareaÍ¢‘„‘Žs corporate pastry chef Robert Truitt. What you wonÍ¢‘„‘Žt get is a solid argument for eating here rather than at another Altamarea venue; if you want refined expensive seafood you can get it in much more attractive surroundings at MareaKung Fu Little Steamed Buns Ramen,New York,Clinton,The specialty at this bare-bones shop is ramen in its original form as it first came to Japan from China: la mian or hand-pulled noodles which are as much theater as comfort food. The chef Peter Song a former actor in China smiles sunnily from a kitchen window as he stretches and swings dough in great spinning slurs. His noodles are chewy dense and so delicious that the soup they swim in seems almost superfluous. Other necessities on the menu include steamed buns (better known in the West as soup dumplings) and thick pleated mantou with pork and gelatin liquefying inside. Telepan Local,New York,TriBeCa,Telepan Local offers almost none of the virtues of small-plates eating with most of the drawbacks. The meal unfolds or unravels on tables the size of the ones in cocktail lounges where in another era people had manhattans and mixed nuts while waiting to be moved to the dining room. Í¢‘„‘ñWeÍ¢‘„‘Žre a farm-to-table American tapas restaurant\u201d my server said one night. Í¢‘„‘ñAll the food is small plates that you can share.\u201d In fact many plates are too small for even one person. Many of them are sensitively made from great ingredients but they are a bit too well-mannered for this style of dining.Parmys Persian Fusion,New York,Upper East Side,Never mind the fusion in the restaurantÍ¢‘„‘Žs name. The mostly classical Persian dishes come from MomÍ¢‘„‘Žs recipes according to the brother-and-sister owners: dense rich stews respectably charred kebabs and gloriously tahdig made with lavash spread beneath rice in a heavy pan and brought nearly to a scorch so it arrives with blackened tips and crunchy seams of flattened rice that pop under the teeth.Jean-Georges,New York,Upper West Side,A radical reimagining of the grand style of French dining when it opened in 1997 Jean-Georges can still surprise even in its comfortable middle age. The restaurant glides like a Mercedes sedan but its chef and founder Jean-Georges Vongerichten takes the curves like a Formula One driver. His disciplined skill for getting the greatest impact from just a few components is his foremost talent. Most of the time you couldnÍ¢‘„‘Žt take something away from one his dishes without hurting the whole. This is why so many of his classics still jump with energy; theyÍ¢‘„‘Žre not dragged down by pointless ornamentation. For anyone feeling left behind by the fashion for scattershot disputatious desserts the multi-part variations created by Joseph Murphy the pastry chef will be an answered prayer. Lucky Luna,Brooklyn,Greenpoint,At Lucky Luna a Mexican-Taiwanese restaurant the two cuisines of its hyphenated premise are mostly neighborly but distinct: posole and tacos here congee and steamed bao buns there. But there is more ambition and finesse than the restaurantÍ¢‘„‘Žs underdressed dining room and low-key snack-ish menu might suggest. The excitement lies in unexpected details like a house-made hot sauce that starts off Chinese with a hit of vinegar and finishes Mexican with a swaggering heat.