name,city,neighborhood,summaryLa Roja de Todos,Queens,Corona,The restaurantÍ¢‘„‘Žs name is in homage to the Chilean national soccer team which is close to the heart of JosÍ—‘© Luis Norambuena the owner a native of ValparaÍ—‘_so Chile. Vania Isler his daughter patiently steers those unfamiliar with her native cuisine toward dishes Í¢‘„‘ñyou can find only here\u201d Í¢‘„‘î like pastel de choclo a casserole topped with a charred crust of corn and basil on which she suggests sprinkling sugar.WafaÍ¢‘„‘Žs Express,Brooklyn,East Williamsburg,The menu at this mostly takeout spot could belong to any of the cityÍ¢‘„‘Žs frill-free Middle Eastern restaurants. But everything here is a little bit more Í¢‘„‘î brighter earthier smokier creamier. The difference is like a washed-out photograph that has been suddenly restored gaining colors and textures you did not know were there. Wafa Chami the chef was born in northern Lebanon to an inheritance of recipes five generations deep with a notable emphasis on sweets.Torishin,New York,Hell's Kitchen,Over charcoal tended by the attentive chefs at Torishin each part of the chicken has a different form of pleasure to offer: chew or crunch subtlety or visceral impact. While some yakitori places favor sweet sauces and heavy blackening the house style is sensitive to timing averse to charring and careful with seasoning.Mama Lee,Queens,Bayside,Mei Lee the eponymous owner of this small plain-spoken Taiwanese restaurant is a no-nonsense figure in apron and bandanna comfortingly bossy. With the help of her uncle in the kitchen she makes homey frankly appealing dishes like three-cup chicken lionÍ¢‘„‘Žs head meatballs and lu rou fan (ground pork braised in soy sauce and Shaoxing wine and poured over rice). Hours are erratic Í¢‘„‘î Ms. Lee likes her freedom Í¢‘„‘î so call ahead.Babbo,New York,Greenwich Village,Mario Batali and his business partner Joe Bastianich own about two dozen restaurants in the United States and Asia. Babbo is the empireÍ¢‘„‘Žs spiritual home where the original formula of adventure and pleasure and curious-minded indulgence is still intact and where you can still try recipes that sprang from Mr. BataliÍ¢‘„‘Žs head when he was just a minor celebrity.Neerob at Packsun Halal Chicken,Bronx,Parkchester,Neerob a Bangladeshi restaurant thought by many to be the cityÍ¢‘„‘Žs best closed last year and re-opened a few blocks away inside a halal fried chicken joint. There the fried chicken is now overshadowed by a steam table of Bangladeshi dishes charged with mustard oil and green chiles and beautiful sweets like rounds of rice-powder dough carved by hand with a wooden needle.Augustine,New York,Financial District,Augustine has the prettiest giddiest interior Keith McNally has ever done. The Parisian flashback mood is so successful that it doesnÍ¢‘„‘Žt matter whether the food resembles anything you might eat in Paris itself.Sugarfish by Sushi Nozawa,New York,Flatiron,Serious sushi can be expensive and diners who are ready to move up from entry-level quality but donÍ¢‘„‘Žt have a lot of money to spend can have a hard time figuring out where to go. Sugarfish which comes to town with a Los Angeles pedigree would like to be the answer. ItÍ¢‘„‘Žs not.Franklin Barbecue,Austin,Austin Tex.,When you finally reach the front of the line at Franklin Barbecue you're asked how much brisket you want. Several considerations come into play of course like the elasticity of your stomach and your taste for pork smoked sausage and turkey. But brisket is the foundation on which Franklin Barbecue was built brisket as it is seasoned and barbecued by the owner and chief pitmaster Aaron Franklin.Butterfunk Kitchen,Brooklyn,Windsor Terrace,Chris Scott the chef built his menu on memories of his NanaÍ¢‘„‘Žs cooking church picnics and neighborhood potlucks. Deviled eggs deep-fried corn on the cob scrapple and fried chicken with a gilding of lemonade honor both his Pennsylvania Dutch and Virginia roots. On Wednesday nights his wife Eugenie Woo brings her heritage to the table with chicken wings in a fever of Korean gochujang fermented chile paste. Mr. ScottÍ¢‘„‘Žs mother who always carried hot sauce in her purse would approve.Little Egypt,Queens,Ridgewood,Nashaat Youssef the chef grew up in Alexandria EgyptÍ¢‘„‘Žs largest seaport and spent a decade cooking at a restaurant steps from the docks; here he takes special pride in his fish including a whole branzino crusted with cracked wheat and blackened over charcoal. His wife Yvette helps in the kitchen and his sons Mark and Wadie pitch in when not at school. Up front a cluster of tables are set with plastic black damask placemats and electric candles; in the back grocery shelves can be read like a library a scholarship of fava beans and black molasses.Weekender Billiard,Queens,Woodside,In a corner of this Bhutanese snooker club portraits of the Dalai Lama and the king and queen of Bhutan tilt over a huddle of dining tables. Under their gaze the waiter brings plates of ema datse the Bhutanese daily meal of chiles and cheese; earthy red rice from high elevations in the Paro Valley; and black tea churned forever with salt and a pat of butter. Tourists to Bhutan must commit to spend $200 to $250 a day in the country; here in Queens snooker tables go for $13 an hour.Sahib,New York,Kips Bay,Sahib darts around India. The menu pays a little bit of attention to several regions and ignores others entirely. This makes it hard to get a firm sense of any one regional style but easy to enjoy a handful of dishes you may have never seen before.Cafe Lily,Brooklyn,Bensonhurst,Lilia Tyan the chef grew up in Tashkent Uzbekistan a descendant of Korean settlers in far eastern Russia who were relocated under StalinÍ¢‘„‘Žs orders to the steppes of central Asia. Her menu in Russian and in English includes traditional Uzbek dishes; the surprises come from the Korean larder. Most nights find her family gathered for dinner with her daughters-in-law getting up from their meals to take customersÍ¢‘„‘Ž orders sometimes with their small children tugging at their sleeves.Chinese Tuxedo,New York,Chinatown,Situated in the stripped-down bones of the first Chinese theater in New York Chinese Tuxedo has a vintage air and a gleam of drama. The menu is described as fusion but it is the smart kind of fusion and often has discernible Chinese antecedents.Dek Sen,Queens,Elmhurst,In this shallow storefront with red gingham tablecloths and rainbow twinkle lights Wirot Sirimatrasit cooks alongside his mother Ramphai Rinnasak a native of Phetchabun in the north of Thailand. They focus on the kind of unshowy full-flavored dishes that are the running stitch of a Thai childhood. This is food as balm for the homesick speaking directly to the Thai immigrants who live in the neighborhood Í¢‘„‘î although all are welcome.White Gold Butchers,New York,Upper West Side,In this restaurant inside a butcher shop the menu gets right to the point no small talk. The main courses fall under the heading Plates. There are usually four of them grilled very simply for dinner. For lunch the focus is on savory pastries like pasties and stubby little sausage rolls.The Gumbo Bros,Brooklyn,Boerum Hill,The chef Adam Lathan grew up on the Gulf Coast of Alabama in Creole country; his business partner Clay Boulware comes from Cajun central Louisiana. They reunited in New York a few years ago to redress the cityÍ¢‘„‘Žs scarcity of gumbo.ChumleyÍ¢‘„‘Žs,New York,West Village,At the address of a famous former speakeasy is a restaurant that has nothing in common with the original except a name a door an archway and framed photographs of and jackets of books by writers who used to drink there. The old regulars would have taken one look at the new menu and called for another shot but the cooking is exciting; some of it even resembles bar food.F.O.B.,Brooklyn,Carroll Gardens,The chef Armando Litiatco was born in the Philippines and grew up in Daly City Calif. which has the countryÍ¢‘„‘Žs highest concentration of people of Filipino descent. Here he serves delicate versions of classic Filipino dishes in a gracious dining room with roomy chairs and light bulbs that rest like cockatoos in wrought-iron bird-cage lanterns. Food comes on grandmotherly mismatched china; family members beam from framed photos.Fowler &amp; Wells,New York,Financial District,Tom Colicchio the chef and owner tries to bring some Gilded Age exuberance to this restaurant in a restored 1883 building. Many of the components including the cocktails wine list and desserts are excellent. But in the menu and the dÍ—‘©cor the central vision is fuzzy and the restaurant is somehow less than the sum of its parts.Lhasa Fast Food,Queens,Jackson Heights,Once Lhasa Fast Food was just a counter at the back of a cellphone store; now it has its own door at the end of a narrow corridor flanked by jewelers. For some diners the more tortuous the journey the more miraculous the meal. But the cooking here Í¢‘„‘î cauldrons of dusky broths heavy with hand-torn scraps of dough and humming with Sichuan peppercorns; momos looking ready to burst their pleats Í¢‘„‘î would be worth seeking out even if it were served in a sleek food hall in Midtown Manhattan.Ichiran,Brooklyn,Bushwick,Ichiran a Japanese ramen chain makes one kind of soup the opaque ivory pork broth called tonkotsu. But it presents a boggling number of choices starting with whether to sit at a table or in one of the Í¢‘„‘ñflavor concentration booths.\u201dVery Fresh Noodles,New York,Chelsea,Í¢‘„‘ñBiang biang\u201d is both the name of the noodles stretched to order at this cramped corner stall in Chelsea Market Í¢‘„‘î straps of dough as wide as a belt drawn out to the wingspan of their maker Í¢‘„‘î and the sound of them snapping against the counter. TheyÍ¢‘„‘Žre at once elastic and dense and too long to fish out of the soup whole; you must pray a little bowing your head to eat. Too bad thereÍ¢‘„‘Žs nowhere to sit. Smart diners come early and grab one of the two windowsills although eating is still a precarious business.Flora Bar,New York City,Upper East Side,Flora Bar inside the Met Breuer is less a restaurant than a wine bar with small tidily formal plates and a drinks list as exhaustive as any artistÍ¢‘„‘Žs career retrospective.Karu CafÍ—‘©,Queens,Woodside,In this unassuming storefront two chefs cook side by side one from Paraguay the other from Venezuela: harmony between otherwise quarreling nations. Venezuelan arepas airy corn cakes barely a fingerÍ¢‘„‘Žs width thick may share the table with Paraguayan chipas dense bulging curls of cassava flour and cornmeal fattened by cheese eggs milk and butter and tasting like gougÍ—‘Îres after a gravitational collapse. Karu means Í¢‘„‘ñto eat\u201d in GuaranÍ—‘_ the indigenous language written into ParaguayÍ¢‘„‘Žs Constitution as equal to Spanish defying the legacy of the conquistadors.Locol,Bronx,Oakland,The chefs Daniel Patterson and Roy Choi are trying to do so many things with their insurgent fast-food chain Locol that it almost has to fall short somewhere. What is surprising though is that they would have so much trouble with the food.The Odeon,New York,TriBeCa,The kitchen retrenched years ago to a comfortably broken-in lineup of French and American standards. Cooking like this is sometimes called comfort food but a better word for the menu and everything else about the Odeon is restorative.Cut by Wolfgang Puck,99 Church Street,Financial District,Wolfgang PuckÍ¢‘„‘Žs hotel steakhouse his first venture in Manhattan felt dated as soon as it opened. The steaks are excellent; other dishes are appealing if a little unfocused and the interior design appears to have been lost in the mail for a decade or so.Pata Cafe,Queens,Elmhurst,At this offshoot of the Thai bar Pata Paplean a tree climbs from the floor through the ceiling. ItÍ¢‘„‘Žs as if youÍ¢‘„‘Žd popped through a trap door into a secret clubhouse. Sunisa Nitmai a native of Isan ThailandÍ¢‘„‘Žs northeast cooks as she would at home: plain-spoken Thai dishes none over $10 that taste of gestures timeworn but never taken for granted and of honest pleasure in what a handful of ingredients can do.Aska,Brooklyn,Williamsburg,Over the past several years few chefs have grown into their ambitions as dramatically and successfully as AskaÍ¢‘„‘Žs Fredrik Berselius. Aska beneath the ribs of the Williamsburg Bridge in July is his third restaurant; with each fresh incarnation his modern Scandinavian nature-boy cooking has taken a leap forward.MaLa Project,New York,East Village,Rooster testicles artery tendon gizzard kidney tongue and heart Í¢‘„‘î all the hidden animal corners that other civilizations treasure but tend to make ours nervous Í¢‘„‘î appear at this modern Chinese restaurant part of an inventory of some sixty-odd potential ingredients for Sichuan dry pot. Unlike with traditional Sichuan hot pot here the chef unseen flips your chosen items in a wok with a philter of chile and spice. They materialize before you in a woven wooden bowl like a dangerous salad. Four levels of Í¢‘„‘ñspiciness\u201d are on offer; even a veteran fire-eater neednÍ¢‘„‘Žt go past three.Bad Saint,Washington D.C.,Washington D.C.,Bad Saint was built to make the best of its scarce square footage not to handle the pressure of being one of WashingtonÍ¢‘„‘Žs most sought-after restaurants. Now it has to do both because the food prepared under columns of wok smoke is richly compelling no matter how many prior run-ins youÍ¢‘„‘Žve had with Filipino food.Mumbai Xpress,Queens,Floral Park,Other places in town serve chaat a vast genre of Indian snacks fueled by salt and tang but perhaps none with the same range and single-minded devotion. Hina Shah the chef opened Mumbai Xpress with her husband Mahendra after relatives and friends insisted that her cooking was too good to keep in her home kitchen. The menu is proof for their argument with vivid offerings that hark back to the chaatwallahs of Chowpatty Beach and Breach Candy in Mumbai and testify to the wisdom of a culture that respects snacks makes them by hand and gives them nuance layers and colliding flavors.Alimentos Saludables,Brooklyn,Sunset Park,This Mexican diner serves some of the best tamales in town slapped on a paper plate and trussed in corn husks still damp with steam. Unshucked they seem almost to breathe. The dough is soft and marbled with sauce so that a little finds its way into every bite. ConcepciÍ—‘_n Gonzalez the chef who started out selling tamales in front of a nearby church is an efficient motherly presence. A statue of baby Jesus in gold robes gazes pacifically from a glass case; HÍ—‘©ctor Acosta might be singing merengue on the jukebox. The menu lists five varieties of tamales most of which will be sold out by dinnertime so come early.Fish Cheeks,New York,NoHo,Specializing in a small number of seafood dishes from around Thailand Fish Cheeks is not a groundbreaking experiment; it simply cooks the way more Thai kitchens should.Thursday Kitchen,New York,East Village,Thursday Kitchen has more interesting cooking than you might expect from a restaurant that serves illuminated cocktails in plastic bags like debauched Capri Suns. Kyungmin Kay Hyun the chef a native of South Korea ferments her own ponzu for 30 days to accompany her exemplary pajeon (scallion pancake); pairs charred octopus with a chardonnay gelÍ—‘©e and a Korean barbecue-like tincture of soy scallions and Asian pear; and tempers crispy pork belly with white kimchi so called because itÍ¢‘„‘Žs made without chile privileging funk over heat.TsuruTonTan Udon Noodle Brasserie,New York,Union Square,ItÍ¢‘„‘Žs now easier to find a ramen shop in Manhattan than a mailbox but udon specialists are rare. TsuruTonTan may be the only one that mixes kneads rolls and cuts the dough for these long pale wheat noodles in its own kitchen.Paowalla,New York,SoHo,Reaching into his back catalog the chef Floyd Cardoz is serving some dishes and even a couple of cocktails like the mind-clearing cucumber-gin highball called the Kachumber Cooler that are flashbacks to the much-missed Tabla and Bread Bar.VioletÍ¢‘„‘Žs Bake Shoppe,Queens,Forest Hills,At this Chinese bakery with a sideline in Vietnamese banh mi the ratios Í¢‘„‘î of bread to charcuterie (almost all made in-house) to pickles to condiments Í¢‘„‘î are golden. The bread is a cloud in crisp armor with a crust that snaps like kindling and then the sandwich is all creaminess salt and heat deeply basal flavors and brisk bright ones every note seemingly struck at once.Divine Flavored Nigerian Food Truck,New York,Midtown East,Godshelter Oluwalogbon the chef behind this Nigerian food truck with bright green hubcaps and a beach scene on its flank was born in Ghana his motherÍ¢‘„‘Žs homeland and raised in Nigeria his fatherÍ¢‘„‘Žs. On weekdays he parks in front of the Nigerian Consulate offering the likes of gizdodo chicken gizzards folded with caramelized plantains; asun dark smoky goat meat sifted with pulverized Scotch bonnets; and ayamase a chunky stew loaded with beef tripe and flagrantly rubbery curls of cow skin.Le Coucou,New York,SoHo,At Daniel RoseÍ¢‘„‘Žs first restaurant in New York the cooking is informed by old-school traditions focuses on animal parts and revolves around glossy spoon-coating cream- and butter-reinforced sauces.Sushi on Jones,New York,NoHo,This tiny no-frills open-air sushi bar is one of five kiosks in the Bowery Market food court on a lot once home to an auto-repair shop. Guests are given 30 minutes to dine; the clock starts at reservation time. This might seem ruthless but the price is kind: $50 for 12 pieces of beautifully fresh fish. The menu reads like a classic-rock playlist Í¢‘„‘î hamachi salmon tuna Í¢‘„‘î but there are surprises like scallop with smoky black salt and uni draped over seared wagyushu beef.The Beatrice Inn,Manhattan,West Village,ItÍ¢‘„‘Žs called a chophouse but the Beatrice Inn is not a place for cautious eaters seeking refuge from the unknown. The menu almost entirely devoted to meat is an opportunity to take chances and eat with abandon.Great Northern Food Hall,New York,Midtown East,ThereÍ¢‘„‘Žs something utopian about the notion that even a hasty inconsequential meal gobbled on a train or at a desk can be Í¢‘„‘î should be Í¢‘„‘î fresh and good. ThatÍ¢‘„‘Žs the mission of this impeccably polished food hall opened in Grand Central Terminal by the Danish restaurateur Claus Meyer a founder of Noma in Copenhagen and a prime mover in defining New Nordic cuisine. Almost every bite here is vivid comforting and at times even profound.Karasu,New York,Fort Greene,Karasu is a speakeasy behind the back wall of a corner tavern. The first surprising thing about the food is that there is any. The second is that itÍ¢‘„‘Žs so polished and considered.Zadie's Oyster Room,New York,East Village,Zadie's is devoted to the oyster in all its edible forms: raw of course but also baked broiled poached in a cream-sherry sauce even pickled.Pondicheri,New York,NoMad,There isnÍ¢‘„‘Žt another restaurant in the city quite like Pondicheri where from breakast through dinner the flavors of India are imported into American daily life.The Chinese Club,Brooklyn,Williamsburg,The Chinese Club looks like a straightforwardly (if self-consciously kitschy) Chinese restaurant. But the food is as Chinese as General TsoÍ¢‘„‘Žs chicken Í¢‘„‘î diaspora cuisine filtered through another nationÍ¢‘„‘Žs consciousness in this case IndiaÍ¢‘„‘Žs. This means Chinese five-spice dusted alongside Indian chaat masala. and liberal slugs of soy and ketchup. One menu item comes with the warning Í¢‘„‘ñNot what you think\u201d and this could apply to almost every dish in ways that sometimes charm and sometimes baffle. These may be dishes that require the halo of nostalgia.Carla HallÍ¢‘„‘Žs Southern Kitchen,Brooklyn,Columbia Street Waterfront District,In a small casual corner spot Carla Hall a host of Í¢‘„‘ñThe Chew\u201d pays tribute to the menacingly spicy fried chicken of PrinceÍ¢‘„‘Žs and other places in Nashville.Joy Luck Palace,New York,Chinatown,Every day hundreds of dumplings buns dense turnip cakes slippery cheong fun and plates of tripe and chicken feet are wheeled around a dining room that would dwarf some nationsÍ¢‘„‘Ž airports. ItÍ¢‘„‘Žs a wonder that anything makes it unsnatched to the far side of the room but somehow the dim-sum cart ladies manage it like Jesus multiplying the loaves and fishes. Much of the food Í¢‘„‘î classics like stuffed bitter melon alongside faddishly cute pig-shaped custard buns Í¢‘„‘î is good if not transcendent and the range is thrilling. Expect a long wait and mayhem.Sauvage,Brooklyn,Greenpoint,At its best Sauvage seems to be on to something exciting a combination of European kitchen discipline and a gut instinct for meeting the appetite head on.Tong Sam Gyup Goo Yi,Queens,Flushing,In Korean pork belly is called samgyupsal or three-layer flesh a name at once poetic and literal. At this barbecue restaurant itÍ¢‘„‘Žs marinated for three days in doenjang (fermented soybean paste) which deepens the porkÍ¢‘„‘Žs natural sweetness without eclipsing it. The gleaming black grill plate on each table mimics the lid of a traditional Korean cauldron allowing the porkÍ¢‘„‘Žs drippings to run down into the wreath of bean sprouts kimchi and garlic cloves snapping on the hot iron below.2nd City,New York,West Village,At this Filipino-leaning taqueria the chef Jordan Andino turns lumpia wrappers into chips for dunking in suka (spiced vinegar his grandmotherÍ¢‘„‘Žs recipe); anoints tacos with sinigang a tangy tamarind soup; and otherwise makes what he calls Í¢‘„‘ñAmAsian\u201d or American-Asian food Í¢‘„‘î more general than specific. The restaurant feels like an extension of his exuberant personality: Í¢‘„‘ñHours of Awesomeness\u201d are posted on the window the staff wear aloha shirts and menu items are written on skateboards the chefÍ¢‘„‘Žs primary mode of transportation.GÍ—‘_nter Seeger NY,New York,West Village,GÍ—‘_nter Seeger who made his name in Atlanta in the 1990s and 2000s is a deeply expressive chef Í¢‘„‘î expressive of the season and of his own focused disciplined style. When youÍ¢‘„‘Žre surprised by his cooking itÍ¢‘„‘Žs because the voice of the ingredients is coming through more clearly than youÍ¢‘„‘Žre used to.Swell Dive,Brooklyn,Bedford Stuyvesant,Swell Dive unites Filipino and Tex-Mex the heritages of the owners Dennis Mendoza born in Quezon City outside Manila and Autumn Stanford from Austin Tex. The Tex-Mex side is more distinct with flour tortillas made daily by hand and queso fervent with cumin and Hatch green chiles. Filipino sisig traditionally a hash of pig head is here made with more approachable pork butt and wonderfully smoky if lacking the sting of citrus. Diners eat in small booths backed by wood peaked-roof frames in weathered tropical colors evoking cabanas.Hao Noodle and Tea by Madam ZhuÍ¢‘„‘Žs Kitchen,New York,Greenwich Village,An energetic entrepreneur named Zhu Rong who owns restaurants in four cities around China recently expanded her territory to Greenwich Village. Ms. Rong brought along a pair of chefs whose skillful manipulation of bubbling oil steam and smoking-hot woks is evident in almost everything they cook invoking traditions from Beijing Shanghai and Chongqing.Woodside Cafe,Queens,Woodside,Woodside Cafe was once a mostly Italian partly Nepalese restaurant opened by a native of Kathmandu who spent 14 years cooking Italian food on the Upper East Side. Now the only trace of the Mediterranean is a pink sauce of tomatoes and heavy cream ladled over momos Himalayan dumplings. The rest of the menu is true to the roof of the world: gossamer flakes of beaten rice; small whole fish deep-fried and meant to be eaten bones and all; and rice-flour crepes under a rubble of meat which some may consider an improvement on pizza.Cassia,Santa Monica,Santa Monica Calif.,One of the most appealing things about Cassia is its pointed lack of interest in being confrontational. The restaurant goes out of its way to be accommodating without doing too much violence to the various Asian cuisines (Vietnamese in particular) that inspire much of the menu.Tsion Cafe,New York,Harlem,Beejhy Barhany the chef was born in northern Ethiopia into a community of Beta Israel as Ethiopian Jews are known. When she was 4 her family fled on foot to Sudan and eventually made its way to Israel. Her menu can read like a biography: eggs scrambled with lox over injera the sour springy Ethiopian flatbread perforated like coral; challah French toast spiked with awaze a meld of earthy-hot berbere and tej Ethiopian honey wine.