name,city,neighborhood,summaryNi Japanese Delicacies,New York,Lower East Side,In the depths of the Essex Street Market on the Lower East Side past the cheesemonger the Latin grocer and the baklava shop stands Ni Japanese Delicacies a cluttered stall without tables or chairs. In the crowded glass case are small plastic bins of exquisite dishes that are only partly Japanese such as octopus cured in yuzu and pitched into chewy sweet hominy and smoked mackerel from Russ &amp; Daughters tucked into a sushi roll . For the owner and chef Atsushi Numata a native of Tokyo who has lived in New York for the past 22 years local sourcing means wandering the neighborhood. This is improvisation not fusion: the classic New York story. Rosemary's ,Manhattan,West Village,There are reasons RosemaryÍ¢‘„‘Žs waiting list has been oversubscribed since its opening. First among them is the spirited cooking of Wade Moises who learned to move gracefully around a scalding pot of spaghetti at Mario BataliÍ¢‘„‘Žs finishing school. You can spot some of the headmasterÍ¢‘„‘Žs knack for energetic flavors in RosemaryÍ¢‘„‘Žs linguine tossed with preserved lemon and threads of hot pickled chiles or in a chilled shrimp antipasto with mint jalapeno and ginger. Most of the prices offer remarkable values given the quality. The same isnÍ¢‘„‘Žt always true of the wine list which has 40 bottles all priced at $40 many with higher-than-usual markups.La Vara,Brooklyn,Cobble Hill,The newest vessel in the small and nimble Spanish armada commanded by Alex Raij and her husband and co-chef Eder Montero who also own Txikito and El Quinto Pino in Manhattan. With La Vara they are exploring new territory the vast legacy of the Jews and Arabs who shared the Iberian Peninsula with Christians for centuries. The imprint of this three-way mixed marriage on SpainÍ¢‘„‘Žs cuisine isnÍ¢‘„‘Žt always evident. La Vara urges and rewards a closer inspection.Biang!,Flushing Queens,Flushing,Biang! is a collaboration between David Shi and his son Jason Wang both natives of the ancient imperial city of XiÍ¢‘„‘Žan in central China. The recipes drawn from that cityÍ¢‘„‘Žs street vendors and casual noodle shops are Mr. ShiÍ¢‘„‘Žs; the design which takes more than a few pointers from places like the Momofuku restaurants is Mr. WangÍ¢‘„‘Žs. The merged sensibilities result in a place where Chinese grandparents can sit down next to young people who may not know the original recipes but can recognize great flavors and a very good deal when they see them. Brooklyn Crab,Red Hook Brooklyn,Red Hook,A block from the Red Hook waterfront stands Brooklyn Crab a shanty writ large three stories high and already looking faintly dilapidated although it was built this past year. The dÍ—‘©cor if such a word applies involves giant gaping fiberglass fish lobster traps and twinkle lights. Out back are rustic bean-bag-toss stations and a bare-bones miniature golf course. The bottom level is essentially a holding pen where people wait sometimes for hours for a proper meal on one of the upper levels. (Drinks and limited food are available perhaps to prevent an uprising.) By the time your name is finally called it is too late. The seafood -- mostly fried and steamed -- is just all right. Grey Lady,New York,Lower East Side,The mood is blithe at Grey Lady whose name salutes befogged Nantucket where the restaurantÍ¢‘„‘Žs owners summered when young. Loiterers at the long marble-topped bar have the air of preppy surfers who will be fox-hunting come fall. This is the seafood shack by way of Ralph Lauren: grainy sunlight through floor-to-ceiling windows pale beach-glass bottles matrices of mismatched mirrors and black-and-white photographs burlap pillows askew on a dusty blue leather couch. It harks back to the kind of New England seaside resort that has no locks on the doors and little recreation beyond adultery and highballs. With this atmosphere the food does not have to be good but it is particularly the lobster roll -- which is also available next door at the restaurantÍ¢‘„‘Žs takeout counter Downeast Clam Shack minus a little meat and the beautiful crowd. Fisherman's Dawta,Boerum Hill Brooklyn,Boerum Hill,At this languidly cluttered Jamaican spot the walls are that blue somewhere between sea shallow and untroubled sky. Reef-print banquettes are encased in plastic a piece of driftwood pins magazines to a battered wood coffee table and Í¢‘„‘ñRedemption Song\u201d is on the speakers. Behind the counter Jennefier Ewers the owner and chef takes orders and cooks squeezing bottles and jostling pans sometimes singing along with Bob Marley. Do not expect speed. Settle out back where stone steps lead to an archetypal oasis of weathered planks leafy trees and turquoise umbrellas. Time expands. All will come including jerk chicken whose coy sweetness gives way to blindsiding heat. This is how Scotch bonnet peppers attack: one detonation after another like a string of firecrackers. Nicoletta,New York,East Village,NicolettaÍ¢‘„‘Žs pizzas are not quite deep dish but they are heading in that direction. The crust is as strong as epoxy and are piled up with an abundance of toppings that would buckle an ordinary pie. In thickness and heft a Nicoletta pizza resembles the September issue of Vogue.Foragers City Table,New York,Chelsea,Foragers City Table which opened in April is an annex to the boutique market Foragers City Grocer. Both are offshoots of Foragers Market in Dumbo Brooklyn which subscribes to the credo of local sourcing and sustainability. The owners run a 28-acre farm in the Hudson Valley that provides the stores and the restaurant with eggs herbs and vegetables some grown some foraged. The menu cadges seasonings from across Asia deploying to sometimes stunning effect Burmese fermented tea leaves Japense yuzu koshu and Vietnamese nuoc mam (fish sauce). The dining room an airy box of polished wood and steel beams is handsome if slightly unspecific -- what might happen if West Elm opened a restaurant. You wish it had more dirt under the fingernails. The adjoining grocery is cozier a lovely place to stroll after dinner stocking up on Whimsy &amp; Spice cookies and blessing all the artisanal vendors in Brooklyn.Reynard,Brooklyn,Williamsburg,Nearly everything that comes out of ReynardÍ¢‘„‘Žs kitchen is chosen by hand and cooked with firewood. The chef Sean Rembold has a farmer who will pick baby okra pods when theyÍ¢‘„‘Žre the size of a AAA battery. He has a fishmonger who can deliver bluefish yanked from the sea so recently it can be served ceviche-style with smoked crÍ—‘Îme frÍ—‘¢iche. Most of the dishes bear the stamp of a grill or a woodburning oven. ReynardÍ¢‘„‘Žs hoods must be powered by jet engines because you donÍ¢‘„‘Žt smell smoke at your table until you get close to your food. Then you canÍ¢‘„‘Žt miss it. Mexicocina,Mott Haven the Bronx,North New York,At this small cheerful storefront in the South Bronx tacos on coarse handmade corn tortillas could take most of their Manhattan rivals in a fight. But it is the daily specials that demand the trek uptown. Mexicocina which opened in 2008 is one of the more formal Mexican joints in these parts which is to say there are a few tables at the back past the takeout counter with its glass vats of horchata and tamarindo. The owner and chef Antonio Vilchis writes courtly thank-you notes to Yelp reviewers asking for ways to improve. Pull up a seat by the brick oven where an electric log flickers and you will soon find your shoulders vibrating to loud Mexican pop. Plate upon plate is delivered more than you thought you asked for. It is food you might be served in a Mexican friendÍ¢‘„‘Žs home on terra-cotta dishes much like these dotted with sunflowers. It is food that makes you feel loved.Atera,New York,TriBeCa,Seasonal cooking in New York has often meant a narrow devotion to simplicity. In the open kitchen behind the counter of this intimate tasting room Matthew Lightner is chasing another path a cuisine that foraged ingredients together with technical sleight of hand to summon up moments of genuine beauty. At times he seems to be feeling his way toward  a highly articulated poetic response to the seasons  that is something like a modern Western version of kaiseki. It doesnÍ¢‘„‘Žt all hang together but so much of it does that a night at Atera is one of the most fascinating experiences you can have in a New York City restaurant.Clyde Frazier's Wine and Dine,New York,Midtown West,It is Godzilla in chinchilla this debonair beast of a restaurant that presides over the far West Side sprawling the length of a city block. Marvin Gaye and the Brothers Johnson are on the soundtrack leopard spots and cowhide on the walls. This is Clyde FrazierÍ¢‘„‘Žs Wine and Dine a cult of personality built around Walt Frazier known as Clyde a notorious sartorialist and National Basketball Association Hall of Famer now a Knicks color commentator with a penchant for effervescent Seussian rhymes. At the restaurant Mr. Frazier is ubiquitous in the streetside scrim of photographic murals from his mutton chop days on the court; in the towering portraits wrapped around pillars calling to mind the statues at the temples of Karnak; and often in the flesh posing and cozying at each table. The main dining room is a relatively subdued haven of dove-gray chairs and white tablecloths. A concrete ramp takes you  past the bar shimmering with some three dozen flat-screen TVs to the lounge where tucked behind a pillar is perhaps the most magical architectural feature of any restaurant in the city: a jewel-box half-basketball court paneled in oak and encased in glass for playing horse between appetizer and entree. Alas the menu has more in common with the Knicks of 2012 than of 1970: it lacks cohesion discipline and flair. Still everyone is having a good time: young black men in preppy swag; white men trying their best in earnest suits; elegant black women dressed up for no oneÍ¢‘„‘Žs pleasure but their own. Behind a pillar a hostess dances goofily by herself as if rehearsing for next June when the Knicks take it all the way.Almayass,New York,Flatiron,The Alexandrians an Armenian family based in Lebanon operate the original Almayass in Beirut along with its spinoffs in Kuwait Riyadh Abu Dhabi Qatar and now New York. All of them have Armenian-and-Lebanese menus shaped by the familyÍ¢‘„‘Žs history. The Alexandrians punch up Lebanese dishes with Armenian accents like lemony grains of crushed red sumac berries and flecks of Aleppo pepper that offer more robust flavor than fiery heat. The restaurant even stages a comeback for some Armenian classics that havenÍ¢‘„‘Žt been served in Manhattan in years. Family values set the tone for the whole experience of eating at Almayass. At times that is refreshing; occasionally like oneÍ¢‘„‘Žs own family it can drive you slightly bananas.Mile End Sandwich,New York,NoHo,Mile End Sandwich the Manhattan offshoot of Mile End deli in Brooklyn looks more like a Helmut Lang boutique than an appetizing shop. The roster of sandwiches more expansive than in Brooklyn reads like a family album of the Jewish diaspora. (The lineup of breads alone is an incantation: rye pumpernickel pletzel challah weck pita poppy onion zaÍ¢‘„‘Žatar.) The chopped liver is made with duck jus the smoked turkey sandwich layered with turkey rillettes. The brisket comes from pastured Angus cows. Inevitably the portions are smaller. Is it truly a deli if the sandwiches donÍ¢‘„‘Žt topple? Quibbling is part of the fun. A few blocks and a world away is KatzÍ¢‘„‘Žs the real thing since 1888. Surely there is room enough in this town for the prodigy and the maestro. Hill Country Barbecue Market,New York,Midtown South,This is a state-of-the-art Manhattan homage to the pre-industrial craft of Texas barbecue particularly as it is practiced in the town of Lockhart. The meat is not as deeply smoky but the crisp salt-and-pepper crust on the moist brisket and the beef and pork ribs does a lot to make up for it. The prime rib and beef shoulder are terrific slabs of roast beef medium rare through and through and the jalapeÍ—‘±o-cheese sausages shipped from Kreuz Market in Lockhart are insistently spicy. Atypically for a barbecue joint the sides and desserts are at least as good as the meat. Hot Kitchen,New York,East Village,The word Í¢‘„‘ñhot\u201d does not adequately convey the seemingly infinite shades of heat that ripple through this small unpretentious Sichuanese restaurant a minimalist canteen in whitewashed brick and red beams that is closer in geography and spirit to N.Y.U. than Chinatown. If you had world enough and time the 164-dish menu would be less frustrating. It helps to have a native speaker in your party. (At least this seems to spur the cooks to be more generous with those precious husks of Sichuan peppercorn the magic bullets of Sichuan cuisine.) Í¢‘„‘ñCold\u201d dishes are among the fiercest here deadlocks of fire and ice. In other plates a single ingredient Í¢‘„‘î like cumin so fragrant you canÍ¢‘„‘Žt tell if you are smelling or tasting it or the salty-sour spoor of pickled amaranth Í¢‘„‘î tips the balance toward revelation. Mandarin pop songs occasionally laced with bossa nova wobble from above. On every table it seems is a different dish. Come prepared to sit heart racing and sweat.Pok Pok Ny,Brooklyn,Columbia Street Waterfront District,Altered perceptions come free with the price of dinner at Pok Pok Ny opened by the chef Andy Ricker of Portland Ore. Mr. RickerÍ¢‘„‘Žs specialty is recreating the food of northern Thailand which has been hard to find in New York City. ItÍ¢‘„‘Žs not as incendiary as the cuisine of other regions and makes great use of the grill; look around the backyard tent and youÍ¢‘„‘Žll see an extraordinary outdoor kitchen where charcoal smolders in a variety of devices. The warm breath of smoke turns up all over the menu as does a parade of little-seen Thai herbs and other ingredients. Unless you arrive very early the wait for a table can be measured in hours but apart from Mr. RickerÍ¢‘„‘Žs takeout wing shop on the Lower East Side there is nowhere else in town to get these flavors.Yopparai,New York,Lower East Side,To enter Yopparai you must climb the stoop of a Lower East Side tenement press a buzzer and wait in the foyer until a pocket door skids open and a figure in black behind a curtain of ropes beckons. But this modest sake bar isnÍ¢‘„‘Žt playing hard to get just making the best of its awkward perch in a repurposed railroad apartment. No password is required Í¢‘„‘î although a reservation helps as there are only 30 seats. And the people who work here seem genuinely happy to be found. The owners Gaku and Christy Shibata work the floor Mr. Shibata tending bar Ms. Shibata keeping guests from noticing how tight the space is. Everything is designed to unknot the mind: cushioned benches for two in lieu of bar stools; sake poured in doll-size cups forcing you to sip; comforting small plates and rustic snacks; a cloudy undertow of jazz. At Yopparai you eat the way you drink in tiny mouthfuls. And so the hours drift. You will not notice. Battersby,New York,Cobble Hill,Exposed-brick walls plank floors tables barely wide enough for a game of checkers Í¢‘„‘î you think you have heard this story before: the new Brooklyn! And then the food arrives and you are under a chandelier at Gramercy Tavern. Well almost. There are limits to what can be achieved in a closet of a kitchen by just three men: Joseph Ogrodnek and Walker Stern who worked together at Alain Ducasse and Anella and chummily share executive-chef duties here and their sous-chef Michael Sowa. But at its best the food at Battersby is thoughtful poised occasionally revelatory. The menu of about a dozen dishes changes as often as three times a week. Best to submit to the five- or seven-course tasting which the chefs improvise on the spot for half what you might pay across the river. This is fine dining in hipsterÍ¢‘„‘Žs clothing: the new new Brooklyn.The NoMad,New York,NoMad,The NoMad is operated by the same duo who run Eleven Madison Park in New York and with a chance to do a second larger more populist restaurant inside the NoMad Hotel Daniel Humm and Will Guidara its ambitious young operators could have taken the well-traveled route with a bistro or trattoria. Instead they have done something rather novel and wonderful. The NoMad takes recipes developed in Mr. HummÍ¢‘„‘Žs kitchen at Eleven Madison Park and translates them into a more open and generous style. ABV Wine Bar ,New York,East Harlem,Childhood nostalgia machismo plus a dash of stick-it-to-the-man: this pretty much sums up the attitude behind ABV Wine Bar. ABVÍ¢‘„‘Žs take on comfort food that is less reinvention than merry spree artisanal ingredients and avant-garde technique in service of the munchies. This translates to the likes of foie-gras fluffernutters and beef-tartare pizza with the occasional emissary from another more rarefied restaurant like pickled veal tongue and charred strawberry sorbet. Diners pack 12 to a table on picnic-bench seats under menu boards with pushpin letters or grab metal stools along the soaring glass storefront. The mood is scrappy populist utterly unlike the Upper East Side. It is not quite a revolution but it could be. Hakkasan New York,New York,Clinton,This multimillion-dollar exercise in Orientalism off Times Square is the seventh in a global chain started in London. Some of the dim sum items including the steamed dumplings can be very good. But some of the main courses are about as interesting as a box of paper clips and everything is deliriously expensive. Catch,New York,West Village,Catch in the meatpacking district has a department storeÍ¢‘„‘Žs dimensions and a nightclubÍ¢‘„‘Žs twitchy heart. It begs the question: Can you eat well at a restaurant with 260 seats bored hostesses incoherent decor and a party-platter-friendly menu primed for franchising? Confoundingly yes. Much of the menu reads like a catalogue: you may order crab by the pound seafood by the tower oysters and Krug as a gift set and mix-and-match fishes and sauces. But there are glimmers of the chefÍ¢‘„‘Žs personality and some expert cooking of monstrous specimens of scallop and titanic whole fish beasts of the deep. Still the bill is a cold shower and when you leave no one meets your eye. You paid your fare you got your ride. They are already moving on to the next wave of high rollers to the next outpost in the works (hello South Beach). You canÍ¢‘„‘Žt help feeling slightly used. Neta,New York,Greenwich Village,One of the two chefs who founded Neta Nick Kim was head chef at Masa. His partner Jimmy Lau was head chef at Bar Masa where among other duties he was in charge of international fish buying. But sushi purists looking for hard-to-obtain Japanese seafood species are likely to be disappointed. Instead Neta has compensatory pleasures like the quality of its rice the exceptional vegetable sushi and above all the small plates like spicy salmon on a sizzling bed of rice or duck skin and foie gras in a thin dugout carved from a cucumber.. Brushed with the chefsÍ¢‘„‘Ž take on hoisin sauce it becomes Peking duck sushi. Back Forty West,New York,SoHo,For Back Forty West Peter Hoffman took the name of his East Village restaurant Back Forty and borrows many of its dishes. Unlike the original Back Forty West is open all day an agreeable corner cafe that pours coffee by 8 a.m. The neighborhood has embraced the restaurant giving the place a confidence and sparkle that take it well beyond the routine farm-to-table tropes. Bar Corvo,Brooklyn,Prospect Heights,In 1998 Emiliano Coppa and Anna Klinger opened Al di LÍ—‘_ a Venetian trattoria on Fifth Avenue in Park Slope then a dodgy strip of boarded-up windows and five-and-dimes. Suddenly Manhattanites started crossing the Brooklyn Bridge for dinner. Fourteen years later the husband-and-wife team have put themselves in canary-in-the-coal-mine territory again opening Bar Corvo in Crown Heights. The menu reprises at a slight discount Al di LÍ—‘_Í¢‘„‘Žs greatest hits including the fabled malfatti naked (i.e. pasta-less) dumplings of ricotta and Swiss chard. Bar Corvo is sleeker than its shabby-chic older sister but less daring in the kitchen. It is not quite a destination restaurant just the restaurant everybody wants in their neighborhood. Anjappar,New York,Kips Bay,Chettinadu cuisine the specialty of this New York franchise of a Chennai-based chain with some two dozen outposts worldwide is surprisingly meat-centric considering its origins in vegetarian-dominated southern India. Ignore the extraneous North Indian dishes on the menu and take the road less traveled by. Previously difficult-to-find delicacies include a curry mobbed by whole garlic cloves with nary a vegetable in sight and stunningly hot braised goat which gains its heat not from piled-on chile peppers but from a complex orchestration of nearly every spice in the Indian larder.Le Bernardin,New York,Midtown,No other restaurant in the city makes the simple cooking of fish (and the fish at Le Bernardin is cooked simply when it is cooked at all) seem so ripe with opportunities for excitement. Under the relentless guidance of Eric Ripert the executive chef and Maguy LeCoze his partner in the business Le Bernardin moves forward without resting. After dining room redesign in 2011 the interior walks in step with the cuisine: up-to-date lively intimate and playful.Miss LilyÍ¢‘„‘Žs Bakeshop &amp; MelvinÍ¢‘„‘Žs Juice Box,New York,Greenwich Village,Miss LilyÍ¢‘„‘Žs Bake Shop &amp; MelvinÍ¢‘„‘Žs Juice Box is a cheerful spot thatÍ¢‘„‘Žs part diner part beachfront snack shack: a handful of tables some bar stools at a counter a pair of benches set outside under striped awnings. The star of the show is MelvinÍ¢‘„‘Žs Juice Box a juice bar where the drinks are more than just liquid multivitamins; theyÍ¢‘„‘Žre carefully constructed compositions with such intense and vivid flavors youÍ¢‘„‘Žll devour them just for the pleasure of how they taste. The Melvin is Melvin Major Jr. a veteran of the juice bar at Lifethyme the health food store in Greenwich Village: he might be New YorkÍ¢‘„‘Žs first celebrity juicer. Order a Catch a Fire (apple beets lemon ginger and cayenne) listen to the D.J. spinning tunes in Miss LilyÍ¢‘„‘Žs Variety next door. Serious juice should always be this fun.Perla,New York,West Village,Perla serves a swaggering red-blooded version of Italian food. Enjoying the cooking of Michael Toscano the chef requires a willingness Í¢‘„‘î even an eagerness Í¢‘„‘î to go a little too far and then tell yourself that too far is exactly where you wanted to be. Beef is a specialty like the sauce beef tartare from a Piedmontese cattle breed or the ribeye steak for two blasted in the wood-burning oven to give it a Fourth of July backyard char. 606 R &amp; D,Brooklyn,Prospect Heights,Brooklyn artisanal but with a genuine retro twist: the chef Ilene Rosen (ex-City Bakery) grew up in Brooklyn and supports local producers old and new. Playful modern food seriously good with a soft spot for childhood snacks and seasonal produce.Cafe China,New York,Midtown South,Some Sichuan-food fanatics would roll their eyes at CafÍ—‘© China. It looks far too pretty for a place serving a cuisine renowned for its chile-powered ability to make eaters teary-eyed and sweaty. But this quaint demure restaurant serves uncompromising Sichuan food that can stand with ManhattanÍ¢‘„‘Žs best. The kitchen can dance a proper ma la two-step intertwining the heat of chiles and the numbing effect of Sichuan peppers. But it also shows great control of flavors at lower degrees of heat. No MSG is used so the smoked tofu with Chinese celery shoots doesnÍ¢‘„‘Žt deliver the same kick in the head youÍ¢‘„‘Žd get at Sichuanese competitors a few blocks away but it does have a clean celery flavor. Even under a blizzard of spices the main ingredients at CafÍ—‘© China taste like themselves. David's Brisket House,Brooklyn,Bedford Stuyvesant,For decades this Brooklyn classic has been turning out the sassiest pastrami sultriest brisket and lean mean corned beef sandwiches in three sizes plus waistline-expanding combos of any two or all three meats. Served warm with pickle spears on the side theyÍ¢‘„‘Žre swooningly good. The fresh corned beef hash is also delectable. Kristalbelli,New York,Koreatown,Korean barbecue goes upscale with smokeless grills made of crystal sommeliers and prices to match. (Fortunately the soju Í¢‘„‘î rice liquor Í¢‘„‘î menu remains affordable.) The food is less punchy than the K-town standard (the meat all Waygu beef isnÍ¢‘„‘Žt even marinated) but the menu more than compensates with extra refinement and quality. 